id,data_emissione,data_scadenza,descrizione,importo,prestatore,committente
cc68f86f-d1fa-4d21-bc03-dbfb2f7d15a7,2025-02-17,2025-03-19,"Consulenza tecnica per l'implementazione di infrastrutture cloud e ottimizzazione dei processi IT. Comprende un'analisi dettagliata delle esigenze del cliente, progettazione della soluzione su misura e supporto tecnico specialistico per l'integrazione nei sistemi esistenti.",3461.8955349009652,"Nicolucci, Togliatti e Abbagnale SPA",Rossi & Figli S.r.l.
8efa4f9f-5e3b-4074-8ba1-f0ad5f6faa2d,2024-09-12,2024-12-11,"Consulenza legale relativa alla revisione e negoziazione di contratti commerciali, inclusa la stesura di clausole contrattuali personalizzate e l'analisi delle implicazioni legali delle normative vigenti. Servizio fornito durante il periodo dal 1 ottobre 2023 al 14 ottobre 2023.",2012.9065521954167,Pace-Branciforte Group,Verdi e Associati S.p.A.
dff5d583-7489-474f-9568-163bc68a3a12,2025-05-24,2025-08-22,"Servizio di direzione lavori per il progetto di ristrutturazione dell'edificio sito in Via Roma, 24, Napoli. Il servizio comprende la supervisione continua del cantiere, coordinamento delle maestranze, controllo qualità delle opere eseguite e gestione della documentazione necessaria fino alla consegna del progetto completato.",1051.9251469791732,Nicolucci s.r.l.,Studio Architettura Rossi & Partners
5d06ecd1-c73f-4e8c-b05a-cebeb208ecf3,2025-04-05,2025-05-05,"Servizi di consulenza fiscale per il trimestre fiscale. Comprende analisi del bilancio, ottimizzazione fiscale e preparazione documentazione per adempimenti tributari.",8717.627434073533,Goldoni-Casadei SPA,Rossi & Figli SRL
e1952307-d50d-4153-8c9e-7ed9ca5d4d68,2025-04-14,2025-07-13,"Servizio di magazzinaggio e gestione logistica per il mese di novembre 2023. Comprende lo stoccaggio, la gestione degli inventari e la preparazione delle spedizioni per conto del cliente. Il servizio garantisce l'integrità e la sicurezza dei prodotti attraverso un monitoraggio continuo e l'uso di tecnologie avanzate per la tracciabilità.",3927.9403789000035,"Cappelli, Mancini e Fittipaldi SPA",Logistic Solutions S.R.L.
0b9c1ab6-c89d-4de8-bd8e-139b6c01a22d,2025-05-04,2025-07-03,Servizio di consulenza tecnica avanzata per l'ottimizzazione dei processi produttivi. Analisi dettagliata delle inefficienze e proposta di soluzioni innovative per la riduzione dei costi operativi. Comprende incontri periodici per la revisione dei progressi e aggiustamenti delle strategie.,5223.078686426937,Bompiani Group,TecnoIndustria S.p.A.
76c9226c-63c3-4b0a-99de-84c6fcca4654,2024-07-19,2024-10-17,"Servizio di direzione lavori per il progetto di ristrutturazione edilizia del complesso residenziale 'Villa Aurora'. Il servizio comprende la supervisione delle attività di cantiere, gestione dei fornitori, coordinamento delle maestranze, controllo della conformità delle opere alle normative vigenti, e assistenza alla consegna finale del progetto.",2674.4835579223472,Monicelli-Gianetti Group,Studio Architettura Rossi & Partners
27b46dac-c017-4218-8618-e99138dec27e,2025-03-07,2025-04-06,"Servizi di Branding: sviluppo e implementazione di una strategia di branding comprensiva di analisi di mercato, definizione del brand positioning, creazione del logo e delle linee guida di comunicazione visiva. Consulenza strategica per il miglioramento della presenza digitale e organizzazione di campagne pubblicitarie mirate.",2133.2506184274716,Guinizzelli-Monteverdi s.r.l.,Italtech Innovations s.p.a.
